,Title,Published_date,Views,Likes,Favorites,Comments,Month
0,"Dr. Natalie Crawford: Female Hormone Health, Fertility & Vitality",2023-11-13,42010,1575,0,165,Nov
1,"Dr. Michael Eisenberg: Improving Male Sexual Health, Function & Fertility",2023-11-06,209520,5160,0,649,Nov
2,"AMA #12: Thoughts on Longevity Supplements (Resveratrol, NR, NMN, Etc.) & How to Improve Memory",2023-10-31,120185,2441,0,250,Oct
3,Mental Health Toolkit: Tools to Bolster Your Mood & Mental Health,2023-10-30,236796,6990,0,599,Oct
4,Mark Zuckerberg & Dr. Priscilla Chan: Curing All Human Diseases & the Future of Health & Technology,2023-10-23,342884,9507,0,3239,Oct
5,Dr. Lisa Feldman Barrett: How to Understand Emotions | Huberman Lab Podcast,2023-10-16,584983,10629,0,1372,Oct
6,How to Increase Your Willpower & Tenacity | Huberman Lab Podcast,2023-10-09,408541,11013,0,1039,Oct
7,Chris Voss: How to Succeed at Hard Conversations | Huberman Lab Podcast,2023-10-02,1414571,16207,0,884,Oct
8,AMA #11: Improve Task Switching & Productivity and Reduce Brain Fog,2023-09-29,105082,2958,0,160,Sep
9,Dr. Paul Conti: Tools and Protocols for Mental Health | Huberman Lab Guest Series,2023-09-27,224359,4726,0,488,Sep
10,U.S. Surgeon General Dr. Vivek Murthy: Efforts & Challenges in Promoting Public Health,2023-09-25,74073,1737,0,813,Sep
11,Dr. Paul Conti: How to Build and Maintain Healthy Relationships | Huberman Lab Guest Series,2023-09-20,295949,6108,0,486,Sep
12,"How to Use Music to Boost Motivation, Mood & Improve Learning | Huberman Lab Podcast",2023-09-18,409975,12508,0,1134,Sep
13,Dr. Paul Conti: How to Improve Your Mental Health | Huberman Lab Guest Series,2023-09-13,383021,7046,0,642,Sep
14,Journal Club with Dr. Peter Attia | Metformin for Longevity & The Power of Belief Effects,2023-09-11,238336,5567,0,500,Sep
15,Dr. Paul Conti: How to Understand & Assess Your Mental Health | Huberman Lab Guest Series,2023-09-06,4252646,33857,0,2241,Sep
16,"Marc Andreessen: How Risk Taking, Innovation & Artificial Intelligence Transform Human Experience",2023-09-04,313071,4050,0,460,Sep
17,"AMA #10: Benefits of Nature & “Grounding,"" Hearing Loss Research & Avoiding Altitude Sickness",2023-08-30,115291,3025,0,306,Aug
18,Goals Toolkit: How to Set & Achieve Your Goals | Huberman Lab Podcast,2023-08-28,613971,16915,0,793,Aug
19,"Dr. David Linden: Life, Death & the Neuroscience of Your Unique Experience | Huberman Lab Podcast",2023-08-21,359072,6143,0,692,Aug
20,Dr. Rena Malik: Improving Sexual & Urological Health in Males and Females | Huberman Lab Podcast,2023-08-14,1073538,23025,0,1354,Aug
21,"Ketamine: Benefits and Risks for Depression, PTSD & Neuroplasticity | Huberman Lab Podcast",2023-08-07,217124,5159,0,997,Aug
22,"Tony Hawk: Harnessing Passion, Drive & Persistence for Lifelong Success | Huberman Lab Podcast",2023-07-31,191971,4720,0,481,Jul
23,"AMA #9: Kratom Risks, Does Infrared Sauna Work & Journaling Benefits",2023-07-28,92024,2062,0,782,Jul
24,Dr. Maya Shankar: How to Shape Your Identity & Goals | Huberman Lab Podcast,2023-07-24,792701,12602,0,1055,Jul
25,How to Enhance Performance & Learning by Applying a Growth Mindset | Huberman Lab Podcast,2023-07-17,942509,25283,0,1283,Jul
26,Dr. Robert Malenka: How Your Brain’s Reward Circuits Drive Your Choices | Huberman Lab Podcast,2023-07-10,713929,8891,0,844,Jul
27,Science-Supported Tools to Accelerate Your Fitness Goals | Huberman Lab Podcast,2023-07-03,488811,11717,0,620,Jul
28,Dr. Jeffrey Goldberg: How to Improve Your Eye Health & Offset Vision Loss | Huberman Lab Podcast,2023-06-26,1841666,18626,0,1150,Jun
29,"AMA #8: Balancing Caffeine, Decision Fatigue & Social Isolation",2023-06-23,158597,4235,0,282,Jun
30,Tim Ferriss: How to Learn Better & Create Your Best Future | Huberman Lab Podcast,2023-06-19,664691,14488,0,757,Jun
31,The Science of MDMA & Its Therapeutic Uses: Benefits & Risks | Huberman Lab Podcast,2023-06-12,232065,4907,0,1333,Jun
32,Dr. Immordino-Yang: How Emotions & Social Factors Impact Learning | Huberman Lab Podcast,2023-06-05,290708,5479,0,618,Jun
33,"AMA #7: Cold Exposure, Maximizing REM Sleep & My Next Scientific Studies",2023-05-31,124189,3329,0,181,May
34,"Adderall, Stimulants & Modafinil for ADHD: Short- & Long-Term Effects | Huberman Lab Podcast",2023-05-29,794755,18592,0,2998,May
35,Dr. Robin Carhart-Harris: The Science of Psychedelics for Mental Health | Huberman Lab Podcast,2023-05-22,465313,8774,0,2305,May
36,Dr. Susanna Søberg: How to Use Cold & Heat Exposure to Improve Your Health | Huberman Lab Podcast,2023-05-15,453641,8698,0,927,May
37,"How Psilocybin Can Rewire Our Brain, Its Therapeutic Benefits & Its Risks | Huberman Lab Podcast",2023-05-08,1618090,36752,0,7392,May
38,"Dr. Noam Sobel: How Smells Influence Our Hormones, Health & Behavior | Huberman Lab Podcast",2023-05-01,1985435,13537,0,1235,May
39,"AMA #6: Eye Health, Why We Yawn & Increasing Motivation",2023-04-27,124507,3602,0,268,Apr
40,Science-Based Mental Training & Visualization for Improved Learning | Huberman Lab Podcast,2023-04-24,511204,13245,0,700,Apr
41,Dr. Matthew MacDougall: Neuralink & Technologies to Enhance Human Brains | Huberman Lab Podcast,2023-04-17,215767,5242,0,698,Apr
42,"The Science of Healthy Hair, Hair Loss and How to Regrow Hair | Huberman Lab Podcast",2023-04-10,1903405,45045,0,4012,Apr
43,"Dr. Elissa Epel: Control Stress for Healthy Eating, Metabolism & Aging | Huberman Lab Podcast",2023-04-03,522145,11128,0,889,Apr
44,Leverage Dopamine to Overcome Procrastination & Optimize Effort | Huberman Lab Podcast,2023-03-27,1018488,26922,0,1769,Mar
45,"AMA #5: Intrusive Thoughts, CGMs, Behavioral Change, Naps & NSDR",2023-03-24,165295,4965,0,324,Mar
46,"Dr. Peter Attia: Improve Vitality, Emotional & Physical Health & Lifespan | Huberman Lab Podcast",2023-03-20,1877499,23496,0,1731,Mar
47,"Dr. Satchin Panda: Intermittent Fasting to Improve Health, Cognition & Longevity | Huberman Lab",2023-03-13,794420,14043,0,1288,Mar
48,How to Optimize Your Water Quality & Intake for Health | Huberman Lab Podcast,2023-03-06,1063097,20641,0,2128,Mar
49,Dr. Oded Rechavi: Genes & the Inheritance of Memories Across Generations | Huberman Lab Podcast,2023-02-27,626677,12833,0,1248,Feb
50,"AMA #4: Maintain Motivation, Improve REM Sleep, Set Goals, Manage Anxiety & More",2023-02-24,239464,8573,0,255,Feb
51,Dr. Andy Galpin: Optimal Nutrition & Supplementation for Fitness | Huberman Lab Guest Series,2023-02-22,3258287,28532,0,1331,Feb
52,"How to Breathe Correctly for Optimal Health, Mood, Learning & Performance | Huberman Lab Podcast",2023-02-20,813992,22317,0,1502,Feb
53,Dr. Andy Galpin: Maximize Recovery to Achieve Fitness & Performance Goals | Huberman Lab,2023-02-15,522467,8493,0,548,Feb
54,"Dr. Gina Poe: Use Sleep to Enhance Learning, Memory & Emotional State | Huberman Lab Podcast",2023-02-13,697071,15533,0,970,Feb
55,Dr. Andy Galpin: Optimize Your Training Program for Fitness & Longevity | Huberman Lab Guest Series,2023-02-08,911153,9779,0,617,Feb
56,How to Stop Headaches Using Science-Based Approaches | Huberman Lab Podcast,2023-02-06,376861,9088,0,1171,Feb
57,Dr. Andy Galpin: How to Build Physical Endurance & Lose Fat | Huberman Lab Guest Series,2023-02-01,3497417,33404,0,1458,Feb
58,Dr. Sara Gottfried: How to Optimize Female Hormone Health for Vitality & Longevity | Huberman Lab,2023-01-30,1585909,42674,0,4449,Jan
59,Dr. Andy Galpin: Optimal Protocols to Build Strength & Grow Muscles | Huberman Lab Guest Series,2023-01-25,1101258,21385,0,1185,Jan
60,How to Optimize Fertility in Males & Females | Huberman Lab Podcast,2023-01-23,254254,5608,0,780,Jan
61,Dr. Andy Galpin: How to Assess & Improve All Aspects of Your Fitness | Huberman Lab Guest Series,2023-01-18,912067,15277,0,936,Jan
62,Rick Rubin: How to Access Your Creativity | Huberman Lab Podcast,2023-01-16,3205346,46612,0,2659,Jan
63,"AMA #3: Adaptogens, Fasting & Fertility, Bluetooth/EMF Risks, Cognitive Load Limits & More",2023-01-13,117367,3153,0,323,Jan
64,Developing a Rational Approach to Supplementation for Health & Performance | Huberman Lab Podcast,2023-01-09,937393,17948,0,1345,Jan
65,"Dr. Sam Harris: Using Meditation to Focus, View Consciousness & Expand Your Mind | Huberman Lab 105",2023-01-02,1102745,23192,0,2891,Jan
66,"Jocko Willink: How to Become Resilient, Forge Your Identity & Lead Others | Huberman Lab Podcast 104",2022-12-26,1407255,34653,0,1844,Dec
67,The Science of Creativity & How to Enhance Creative Innovation | Huberman Lab Podcast 103,2022-12-19,299758,8229,0,628,Dec
68,"LIVE EVENT Q&A: Dr. Andrew Huberman Question & Answer in New York, NY",2022-12-14,133580,3497,0,259,Dec
69,Dr. Kyle Gillett: Tools for Hormone Optimization in Males | Huberman Lab Podcast 102,2022-12-12,842930,18925,0,1195,Dec
70,"AMA #2: Improve Sleep, Reduce Sugar Cravings, Optimal Protein Intake, Stretching Frequency & More",2022-12-08,307405,7943,0,399,Dec
71,Using Caffeine to Optimize Mental & Physical Performance | Huberman Lab Podcast 101,2022-12-05,669705,15204,0,1298,Dec
72,"Dr Lex Fridman: Navigating Conflict, Finding Purpose & Maintaining Drive | Huberman Lab Podcast #100",2022-11-28,977594,22857,0,2194,Nov
73,Dr. Chris Palmer: Diet & Nutrition for Mental Health | Huberman Lab Podcast #99,2022-11-21,4453311,48973,0,3567,Nov
74,Science-Based Tools for Increasing Happiness | Huberman Lab Podcast #98,2022-11-14,1263367,19621,0,1284,Nov
75,"LIVE EVENT Q&A: Dr. Andrew Huberman Question & Answer in Los Angeles, CA",2022-11-09,112567,2954,0,200,Nov
76,"Dr Layne Norton: The Science of Eating for Health, Fat Loss & Lean Muscle | Huberman Lab Podcast #97",2022-11-07,4256860,49286,0,2502,Nov
77,"AMA #1: Leveraging Ultradian Cycles, How to Protect Your Brain, Seed Oils Examined and More",2022-11-02,171980,4990,0,259,Nov
78,How Meditation Works & Science-Based Effective Meditations | Huberman Lab Podcast #96,2022-10-31,3420784,67380,0,3398,Oct
79,Dr. Eddie Chang: The Science of Learning & Speaking Languages | Huberman Lab Podcast #95,2022-10-24,326620,8335,0,532,Oct
80,Fitness Toolkit: Protocol & Tools to Optimize Physical Health | Huberman Lab Podcast #94,2022-10-17,1077678,22435,0,1230,Oct
81,Dr. Nolan Williams: Psychedelics & Neurostimulation for Brain Rewiring | Huberman Lab Podcast #93,2022-10-10,344792,8093,0,1099,Oct
82,The Effects of Cannabis (Marijuana) on the Brain & Body | Huberman Lab Podcast #92,2022-10-03,2673720,63370,0,8838,Oct
83,Dr. Casey Halpern: Biology & Treatments for Compulsive Eating & Behaviors | Huberman Lab Podcast #91,2022-09-26,239489,5690,0,496,Sep
84,Nicotine’s Effects on the Brain & Body & How to Quit Smoking or Vaping | Huberman Lab Podcast #90,2022-09-19,1107288,25123,0,2973,Sep
85,"Dr. David Anderson: The Biology of Aggression, Mating, & Arousal | Huberman Lab Podcast #89",2022-09-12,186572,4576,0,491,Sep
86,Focus Toolkit: Tools to Improve Your Focus & Concentration | Huberman Lab Podcast #88,2022-09-05,930031,25372,0,1144,Sep
87,"LIVE EVENT Q&A: Dr. Andrew Huberman Question & Answer in Portland, OR",2022-08-31,98200,3081,0,228,Aug
88,"Dr. Erich Jarvis: The Neuroscience of Speech, Language & Music | Huberman Lab Podcast #87",2022-08-29,177285,5303,0,626,Aug
89,"What Alcohol Does to Your Body, Brain & Health | Huberman Lab Podcast #86",2022-08-22,5526150,111423,0,10114,Aug
90,"LIVE EVENT Q&A: Dr. Andrew Huberman Question & Answer in Seattle, WA",2022-08-17,151008,5003,0,400,Aug
91,"Dr. Peter Attia: Exercise, Nutrition, Hormones for Vitality & Longevity | Huberman Lab Podcast #85",2022-08-15,1448437,28831,0,1726,Aug
92,Sleep Toolkit: Tools for Optimizing Sleep & Sleep-Wake Timing | Huberman Lab Podcast #84,2022-08-08,1625417,38649,0,1990,Aug
93,Dr. Emily Balcetis: Tools for Setting & Achieving Goals | Huberman Lab Podcast #83,2022-08-01,422696,11620,0,695,Aug
94,The Science & Treatment of Bipolar Disorder | Huberman Lab Podcast #82,2022-07-25,727426,16163,0,2550,Jul
95,Dr. Charles Zuker: The Biology of Taste Perception & Sugar Craving | Huberman Lab Podcast #81,2022-07-18,151114,4107,0,516,Jul
96,Optimize & Control Your Brain Chemistry to Improve Health & Performance | Huberman Lab Podcast #80,2022-07-11,493633,12238,0,959,Jul
97,Jeff Cavaliere: Optimize Your Exercise Program with Science-Based Tools | Huberman Lab Podcast #79,2022-07-04,1927124,32039,0,1916,Jul
98,The Science & Treatment of Obsessive Compulsive Disorder (OCD) | Huberman Lab Podcast #78,2022-06-27,473475,10469,0,1342,Jun
99,Ido Portal: The Science & Practice of Movement | Huberman Lab Podcast #77,2022-06-20,404247,10616,0,1278,Jun
100,Improve Flexibility with Research-Supported Stretching Protocols | Huberman Lab Podcast #76,2022-06-13,3105232,45479,0,1712,Jun
101,"Dr. Paul Conti: Therapy, Treating Trauma & Other Life Challenges | Huberman Lab Podcast #75",2022-06-06,692130,16153,0,1384,Jun
102,The Science & Process of Healing from Grief | Huberman Lab Podcast #74,2022-05-30,626125,17316,0,2186,May
103,Dr. Wendy Suzuki: Boost Attention & Memory with Science-Based Tools | Huberman Lab Podcast #73,2022-05-23,653281,19845,0,1055,May
104,Understand & Improve Memory Using Science-Based Tools | Huberman Lab Podcast #72,2022-05-16,677785,17518,0,1065,May
105,Understanding & Controlling Aggression | Huberman Lab Podcast #71,2022-05-09,236871,6907,0,633,May
106,Dr. Rhonda Patrick: Micronutrients for Health & Longevity | Huberman Lab Podcast #70,2022-05-02,1040720,22935,0,2109,May
107,The Science & Health Benefits of Deliberate Heat Exposure | Huberman Lab Podcast #69,2022-04-25,584545,12616,0,980,Apr
108,"Using Light (Sunlight, Blue Light & Red Light) to Optimize Health | Huberman Lab Podcast #68",2022-04-18,681708,18087,0,1540,Apr
109,Dr. Kyle Gillett: How to Optimize Your Hormones for Health & Vitality | Huberman Lab Podcast #67,2022-04-11,543502,12417,0,975,Apr
110,Using Deliberate Cold Exposure for Health and Performance | Huberman Lab Podcast #66,2022-04-04,1421100,28374,0,1795,Apr
111,"Dr. Andy Galpin: How to Build Strength, Muscle Size & Endurance | Huberman Lab Podcast #65",2022-03-28,4252563,50017,0,1993,Mar
112,Controlling Sugar Cravings & Metabolism with Science-Based Tools | Huberman Lab Podcast #64,2022-03-21,1184949,26662,0,1489,Mar
113,Using Salt to Optimize Mental & Physical Performance | Huberman Lab Podcast #63,2022-03-14,1629202,34154,0,2280,Mar
114,"Dr. Justin Sonnenburg: How to Build, Maintain & Repair Gut Health | Huberman Lab Podcast #62",2022-03-07,1559822,30721,0,2019,Mar
115,How to Enhance Your Gut Microbiome for Brain & Overall Health | Huberman Lab Podcast #61,2022-02-28,765449,17723,0,1305,Feb
116,Dr. David Spiegel: Using Hypnosis to Enhance Health & Performance | Huberman Lab Podcast #60,2022-02-21,343362,9281,0,708,Feb
117,"The Science of Love, Desire and Attachment | Huberman Lab Podcast #59",2022-02-14,1721843,30620,0,1536,Feb
118,Using Play to Rewire & Improve Your Brain | Huberman Lab Podcast #58,2022-02-07,333584,9651,0,942,Feb
119,"Optimizing Workspace for Productivity, Focus, & Creativity | Huberman Lab Podcast #57",2022-01-31,502515,13835,0,960,Jan
120,Dr. Alia Crum: Science of Mindsets for Health & Performance | Huberman Lab Podcast #56,2022-01-24,622285,17709,0,1056,Jan
121,The Science of Setting & Achieving Goals | Huberman Lab Podcast #55,2022-01-17,1390282,34601,0,1736,Jan
122,Dr. Jack Feldman: Breathing for Mental & Physical Health & Performance | Huberman Lab Podcast #54,2022-01-10,688106,17643,0,1006,Jan
123,The Science of Making & Breaking Habits | Huberman Lab Podcast #53,2022-01-03,3868542,72111,0,1837,Jan
124,Dr. David Sinclair: The Biology of Slowing & Reversing Aging | Huberman Lab Podcast #52,2021-12-27,2909166,70094,0,4647,Dec
125,"Science of Social Bonding in Family, Friendship & Romantic Love | Huberman Lab Podcast #51",2021-12-20,483004,13723,0,1115,Dec
126,Dr. David Berson: Your Brain's Logic & Function | Huberman Lab Podcast #50,2021-12-13,217112,5684,0,576,Dec
127,Erasing Fears & Traumas Based on the Modern Neuroscience of Fear | Huberman Lab Podcast #49,2021-12-06,1316435,34245,0,2389,Dec
128,Dr. David Buss: How Humans Select & Keep Romantic Partners in Short & Long Term | Huberman Lab  #48,2021-11-29,726653,21273,0,2641,Nov
129,The Science of Gratitude & How to Build a Gratitude Practice | Huberman Lab Podcast #47,2021-11-22,857784,24398,0,1725,Nov
130,"Time Perception & Entrainment by Dopamine, Serotonin & Hormones | Huberman Lab Podcast #46",2021-11-15,463068,12454,0,824,Nov
131,Dr. Duncan French: How to Exercise for Strength Gains & Hormone Optimization | Huberman Lab #45,2021-11-08,297972,8738,0,785,Nov
132,Using Your Nervous System to Enhance Your Immune System | Huberman Lab Podcast #44,2021-11-01,573885,12662,0,1251,Nov
133,"Dr. Samer Hattar: Timing Light, Food, & Exercise for Better Sleep, Energy & Mood | Huberman Lab #43",2021-10-25,211361,6653,0,839,Oct
134,Nutrients For Brain Health & Performance | Huberman Lab Podcast #42,2021-10-18,1148419,28186,0,1604,Oct
135,Effects of Fasting & Time Restricted Eating on Fat Loss & Health | Huberman Lab Podcast #41,2021-10-11,5212769,102360,0,5336,Oct
136,"Dr. Craig Heller: Using Temperature for Performance, Brain & Body Health | Huberman Lab Podcast #40",2021-10-04,245910,6839,0,876,Oct
137,"Controlling Your Dopamine For Motivation, Focus & Satisfaction | Huberman Lab Podcast #39",2021-09-27,7868163,241269,0,8914,Sep
138,Dr. Matthew Johnson: Psychedelics for Treating Mental Disorders | Huberman Lab Podcast #38,2021-09-20,512918,11526,0,1445,Sep
139,ADHD & How Anyone Can Improve Their Focus | Huberman Lab Podcast #37,2021-09-13,5219594,120225,0,9878,Sep
140,"Healthy Eating & Eating Disorders - Anorexia, Bulimia, Binging | Huberman Lab Podcast #36",2021-09-06,419208,10833,0,963,Sep
141,"Dr. Robert Sapolsky: Science of Stress, Testosterone & Free Will | Huberman Lab Podcast #35",2021-08-30,1373787,39938,0,3044,Aug
142,Understanding & Conquering Depression | Huberman Lab Podcast #34,2021-08-23,1556553,37542,0,3189,Aug
143,Dr. Anna Lembke: Understanding & Treating Addiction | Huberman Lab Podcast #33,2021-08-16,1796775,51822,0,4285,Aug
144,How to Control Your Sense of Pain & Pleasure | Huberman Lab Podcast #32,2021-08-09,253390,7039,0,707,Aug
145,Dr. Matthew Walker: The Science & Practice of Perfecting Your Sleep | Huberman Lab Podcast #31,2021-08-02,2099406,43638,0,2642,Aug
146,How to Optimize Your Brain-Body Function & Health | Huberman Lab Podcast #30,2021-07-26,334155,9969,0,1190,Jul
147,"Dr. Lex Fridman: Machines, Creativity & Love | Huberman Lab Podcast #29",2021-07-19,1333641,15021,0,1880,Jul
148,"Maximizing Productivity, Physical & Mental Health with Daily Tools | Huberman Lab Podcast #28",2021-07-12,638513,18884,0,1375,Jul
149,"The Science of Hearing, Balance & Accelerated Learning | Huberman Lab Podcast #27",2021-07-05,241859,6790,0,910,Jul
150,Dr. Karl Deisseroth: Understanding & Healing the Mind | Huberman Lab Podcast #26,2021-06-28,383857,11414,0,983,Jun
151,"How Smell, Taste & Pheromone-Like Chemicals Control You | Huberman Lab Podcast #25",2021-06-21,215423,5823,0,759,Jun
152,"The Science of Vision, Eye Health & Seeing Better | Huberman Lab Podcast #24",2021-06-14,1500568,41238,0,3150,Jun
153,How To Build Endurance In Your Brain & Body | Huberman Lab Podcast #23,2021-06-07,1167668,24941,0,1395,Jun
154,"Science of Muscle Growth, Increasing Strength & Muscular Recovery | Huberman Lab Podcast #22",2021-05-31,4652987,103497,0,3790,May
155,How to Lose Fat with Science-Based Tools | Huberman Lab Podcast #21,2021-05-24,4316704,96912,0,4668,May
156,How to Learn Skills Faster | Huberman Lab Podcast,2021-05-17,889909,24194,0,1734,May
157,Supercharge Exercise Performance & Recovery with Cooling | Huberman Lab Podcast #19,2021-05-10,323677,11246,0,1541,May
158,Using Cortisol & Adrenaline to Boost Our Energy & Immune System Function | Huberman Lab Podcast #18,2021-05-03,547517,15308,0,1421,May
159,How to Control Your Metabolism by Thyroid & Growth Hormone | Huberman Lab Podcast #17,2021-04-26,756861,18832,0,1618,Apr
160,"How Our Hormones Control Our Hunger, Eating & Satiety | Huberman Lab Podcast #16",2021-04-19,1080494,29369,0,2015,Apr
161,The Science of How to Optimize Testosterone & Estrogen | Huberman Lab Podcast #15,2021-04-12,1901478,48780,0,2781,Apr
162,Reduce Anxiety & Stress with the Physiological Sigh | Huberman Lab Quantal Clip,2021-04-07,558431,22251,0,690,Apr
163,"Biological Influences On Sex, Sex Differences & Preferences | Huberman Lab Podcast #14",2021-04-05,261785,8500,0,1060,Apr
164,The Science of Emotions & Relationships | Huberman Lab Podcast,2021-03-29,1391939,32359,0,1411,Mar
165,How to Control Stress in Real-Time | Huberman Lab Quantal Clip,2021-03-24,211496,11075,0,502,Mar
166,How to Increase Motivation & Drive | Huberman Lab Podcast #12,2021-03-22,1566852,44985,0,2325,Mar
167,How Foods and Nutrients Control Our Moods | Huberman Lab Podcast #11,2021-03-15,1178552,32182,0,2130,Mar
168,Tools for Managing Stress & Anxiety | Huberman Lab Podcast #10,2021-03-08,1926406,50781,0,2553,Mar
169,Control Pain & Heal Faster with Your Brain | Huberman Lab Podcast #9,2021-03-01,388713,12251,0,1284,Mar
170,Optimize Your Learning & Creativity with Science-based Tools | Huberman Lab Podcast #8,2021-02-22,429651,14427,0,1366,Feb
171,"Using Failures, Movement & Balance to Learn Faster | Huberman Lab Podcast #7",2021-02-15,1227357,40518,0,2788,Feb
172,How to Focus to Change Your Brain | Huberman Lab Podcast #6,2021-02-08,2131206,62224,0,3380,Feb
173,Understanding and Using Dreams to Learn and to Forget | Huberman Lab Podcast #5,2021-02-01,803593,21174,0,2037,Feb
174,"How to Defeat Jetlag, Shift Work & Sleeplessness | Huberman Lab Podcast #4",2021-01-25,437884,12144,0,1412,Jan
175,"Using Science to Optimize Sleep, Learning & Metabolism | Huberman Lab Podcast #3",2021-01-18,1220664,34831,0,1980,Jan
176,Master Your Sleep & Be More Alert When Awake | Huberman Lab Podcast #2,2021-01-11,3166128,93682,0,4852,Jan
177,How Your Nervous System Works & Changes | Huberman Lab Podcast #1,2021-01-04,1213441,51585,0,2972,Jan
178,Welcome to the Huberman Lab Podcast,2020-12-23,764882,15752,0,2377,Dec
